ROWNUM;Name;Location;Type;TypePhoto;Power;AdmArea;X_WGS;Y_WGS;GLOBALID;
700;"Часы";"Семеновская пл., д1 пересечение с Измайловским валом 4 оп.";"КП 098-01";"";"0.125";"Восточный АО";"37.720636";"55.782461";"92387053";
701;"Часы";"Киевского вокзала пл., стр2 пересечение с Б.Дорогомиловской ул.";"КП 098-01";"";"0.125";"Западный АО";"37.568273";"55.744862";"92387054";
702;"Часы";"Садовая-Триумфальная ул., д22/31 пересечение с ул.М.Дмитровка";"КП 098-01";"";"0.125";"Центральный АО";"37.604351";"55.772137";"92387055";
703;"Часы";"Масловка Нижн.ул., д10 пересечение с Башиловской ул.";"КП 098-01";"";"0.125";"Северный АО";"37.577553";"55.792086";"92387056";
704;"Часы";"Барклая ул., д8 пересечение с Багратионовским пр.";"КП 098-01";"";"0.125";"Западный АО";"37.501346";"55.741241";"92387057";
705;"Часы";"Можайское шоссе, д39";"КП 098-01";"";"0.125";"Западный АО";"37.413515";"55.717878";"92387058";
706;"Часы";"Мира просп., д53 пересечение с Капельским пер.";"КП 098-01";"";"0.125";"Центральный АО";"37.634703";"55.784905";"92387059";
707;"Часы";"Садовая-Спасская ул., д12 пересечение с просп.Академика Сахарова";"КП 098-01";"";"0.125";"Центральный АО";"37.642858";"55.770342";"92387060";
708;"Часы";"Дорогомиловская Б.ул., у ТЦ""Европа"" пересечение со 2-м Брянским пер.";"КП 098-01";"";"0.125";"Западный АО";"37.565211";"55.745485";"92387061";
709;"Часы";"Трубная пл., напротив д14/29 (пересечение с Петровским бульв.)";"КП 098-01";"";"0.125";"Центральный АО";"37.621409";"55.767173";"92387062";
710;"Часы";"Смоленский б-р, д11/2 пересечение Неопалимовским пер.";"КП 098-01";"";"0.125";"Центральный АО";"37.584287";"55.74099";"92387063";
711;"Часы";"Варшавское шоссе, д41 напротив ""Ферейн""";"КП 098-01";"";"0.125";"Южный АО";"37.623423";"55.682475";"92387064";
712;"Часы";"Пришвина ул., д9/2 пересчение с Мурановской ул.";"КП 098-01";"";"0.125";"Северо-Восточный АО";"37.596391";"55.889266";"92387065";
713;"Часы";"Новая пл., д8 пересечение с М.Черкасским пер.";"КП 098-01";"";"0.125";"Центральный АО";"37.626678";"55.758604";"92387066";
714;"Часы";"Садовая Б.ул., д8 пересечение с местным пр.";"КП 098-01";"";"0.125";"Центральный АО";"37.592626";"55.766937";"92387067";
715;"Часы";"Грузинская Б.ул., д60 к1 пересечение со 2-й Бресткой ул.";"КП 098-01";"";"0.125";"Центральный АО";"37.584798";"55.772144";"92387068";
716;"Часы";"Ордынка Б.ул., д24/28";"КП 098-01";"";"0.125";"Центральный АО";"37.624542";"55.740105";"92387069";
717;"Часы";"Фомичевой ул., д16 к5 м.""Планерная""";"КП 098-01";"";"0.125";"Северо-Западный АО";"37.437142";"55.859443";"92387070";
718;"Часы";"Каланчевская ул., д6/2 пересечение с местным пр.";"КП 098-01";"";"0.125";"Центральный АО";"37.65224";"55.771831";"92387071";
719;"Часы";"Красина ул., д9 пересечение с ул.Гашека";"КП 098-01";"";"0.125";"Центральный АО";"37.58811";"55.767249";"92387072";
720;"Часы";"Боровское шоссе, д38";"КП 098-01";"";"0.125";"Западный АО";"37.352515";"55.638196";"92387073";
721;"Часы";"Боровское шоссе, д46 магазин ""Патэрсон""";"КП 098-01";"";"0.125";"Западный АО";"37.348915";"55.636333";"92387074";
722;"Часы";"Мухиной Скульптора ул., д4 универсам ""Геркулесия""";"КП 098-01";"";"0.125";"Западный АО";"37.349158";"55.643772";"92387075";
723;"Часы";"Ляпидевского ул., д12 стр2 пересечение с местным пр.";"КП 098-01";"";"0.125";"Северный АО";"37.496022";"55.856582";"92387076";
724;"Часы";"Трофимова ул., м.""Кожуховская"" 1 опора пересечение с Южнопортовой ул. 1 оп.";"КП 098-04";"";"0.125";"Юго-Восточный АО";"37.686638";"55.706195";"92387077";
725;"Часы";"Новопеределкинская ул., д10а пересечение с Новоорловской ул.";"КП 098-04";"";"0.125";"Западный АО";"37.366918";"55.640487";"92387078";
726;"Часы";"Краснопрудная ул., д13 пересечение с Гаврикова ул.";"КП 098-04";"";"0.125";"Центральный АО";"37.667834";"55.781781";"92387079";
727;"Часы";"Гаврикова улица, ; д1 пересечение с Русаковской ул.";"КП 098-04";"";"0.125";"Центральный АО";"37.67222";"55.780566";"92387080";
728;"Часы";"Переяславская Б.ул., д36 пересечение с Банным пер.";"КП 098-04";"";"0.125";"Центральный АО";"37.641113";"55.786038";"92387081";
729;"Часы";"Центральный просп., д1 префектура пересечение с Березовой аллеей";"КП 098-04";"";"0.125";"Зеленоградский АО";"37.213342";"55.989972";"92387082";
730;"Часы";"Митинская ул., напротив д53 пересечение с Ангелов пер.";"КП 098-04";"";"0.125";"Северо-Западный АО";"37.35245";"55.853025";"92387083";
731;"Часы";"Дубравная ул., д34/29 пересечение с Митинской ул.";"КП 098-04";"";"0.125";"Северо-Западный АО";"37.359584";"55.846279";"92387084";
732;"Часы";"Барышиха ул., напротив д21 пересечение с 3-м Митинским пер.";"КП 098-04";"";"0.125";"Северо-Западный АО";"37.348055";"55.845514";"92387085";
733;"Часы";"Мира просп., д150 пересечение с ул.Космонавтов";"КП 098-04";"";"0.125";"Северо-Восточный АО";"37.643655";"55.822488";"92387086";
734;"Часы";"Остоженка ул., д53 пересечение с Новокрымским пр.";"КП 098-04";"";"0.125";"Центральный АО";"37.594992";"55.736209";"92387087";
735;"Часы";"Центральный просп., корп. 406";"КП 098-04";"";"0.125";"Зеленоградский АО";"37.618874";"55.656058";"92387088";
736;"Часы";"Дубининская ул., напротив д11/17 пересечение с Стремянным пер.";"КП 098-03";"";"0.125";"Центральный АО";"37.636769";"55.728191";"92387089";
737;"Часы";"Кутузовский просп., д30/32 м ""Кутузовская""";"КП 098-01";"";"0.12";"Западный АО";"37.536364";"55.740826";"92387090";
738;"Часы";"Куусинена ул., д4/6";"КП-098";"";"0.125";"Северный АО";"37.516449";"55.77985";"92387091";
739;"Часы";"Куусинена ул., д13";"АЧС-800";"";"0.08";"Северный АО";"37.513869";"55.78405";"92387092";
740;"Часы";"Павелецкого вокзала пл., напротив д1 Павелецкий вокзал";"КП 098-01";"";"0.125";"Центральный АО";"37.637146";"55.730949";"92387093";
741;"Часы";"Ленинградский просп., д31 Стадион ""Юных пионеров""";"КП 098-01";"";"0.12";"Северный АО";"37.560056";"55.787513";"92387094";
742;"Часы";"Ленинградский просп., д36 Театральная аллея(м.""Динамо"")";"КП 098-01";"";"0.12";"Северный АО";"37.555983";"55.790387";"92387095";
743;"Часы";"Ленинградский просп., д39 ЦСКА";"КП 098-01";"";"0.12";"Северный АО";"37.540148";"55.796345";"92387096";
744;"Часы";"Ленинградский просп., д40 Академия им. Жуковского";"КП 098-01";"";"0.12";"Северный АО";"37.549945";"55.793052";"92387097";
745;"Часы";"Ленинградский просп., д62 м.""Аэропорт""";"КП 098-01";"";"0.12";"Северный АО";"37.533494";"55.79867";"92387098";
746;"Часы";"Ленинградское шоссе, д8/2";"КП 098-01";"";"0.08";"Северный АО";"37.500442";"55.816619";"92387099";
747;"Часы";"Ленинградский просп., д73 А";"КП 098-01";"";"0.125";"Северный АО";"37.513205";"55.803264";"92387100";
748;"Часы";"Ленинградский просп., д76 м. ""Сокол""";"КП 098-01";"";"0.12";"Северный АО";"37.514797";"55.805433";"92387101";
749;"Часы";"Героев Панфиловцев ул., д1";"КП 098-01";"";"0.12";"Северо-Западный АО";"37.438426";"55.853563";"92387102";
750;"Часы";"Ленинградское шоссе, д12";"АЧС 2-900";"";"0.125";"Северный АО";"37.497665";"55.819567";"92387103";
751;"Часы";"Ленинградское шоссе, д25";"КП-098";"";"0.125";"Северный АО";"37.489007";"55.829424";"92387104";
752;"Часы";"Ленинградское шоссе, д51 Гл.вх. Речного вокзала";"КП 098-01";"";"0.12";"Северный АО";"37.472244";"55.851867";"92387105";
753;"Часы";"Ленинградское шоссе, д53 Сев.вх. Речного вокзал";"КП 098-01";"";"0.12";"Северный АО";"37.469758";"55.855591";"92387106";
754;"Часы";"Ленинский просп., д146 пересечение с ул.26 Бакинских комиссаров";"КП 098-01";"";"0.12";"Юго-Западный АО";"37.496295";"55.656189";"92387107";
755;"Часы";"Ленинский просп., д2 м.""Октябрьская""-кольцевая";"КП-098";"";"0.125";"Центральный АО";"37.611737";"55.729486";"92387108";
756;"Часы";"Ленинский просп., д3 магазин ""Подарки""";"КП-098";"";"0.125";"Центральный АО";"37.607916";"55.726124";"92387109";
757;"Часы";"Ленинский просп., д41 магазин ""Ткани""";"КП 098-04/1";"";"0.14";"Юго-Западный АО";"37.578549";"55.706509";"92387110";
758;"Часы";"Ленинский просп., д54 магазин ""Москва""";"КП 098-01";"";"0.12";"Юго-Западный АО";"37.561723";"55.697625";"92387111";
759;"Часы";"Ленинский просп., д63 пересечение с ул.Дм.Ульянова";"КП 098-01";"";"0.12";"Юго-Западный АО";"37.556312";"55.694073";"92387112";
760;"Часы";"Ленинский просп., д74 пересечение с ул. Строителей";"АЧС-800";"";"0.08";"Юго-Западный АО";"37.539476";"55.68434";"92387113";
761;"Часы";"Ленинский просп., д90 пересечение с ул.Кравченко";"АЧС-800";"";"0.08";"Юго-Западный АО";"37.524119";"55.673911";"92387114";
762;"Часы";"Ленинский просп., д92 пересечение с ул.Удальцова";"КП 098-01";"";"0.12";"Юго-Западный АО";"37.519579";"55.670823";"92387115";
763;"Часы";"Ломоносовский просп., пересечение с Мичуринским просп.";"КП 098-01";"";"0.12";"Западный АО";"37.514763";"55.70538";"92387116";
764;"Часы";"Ломоносовский просп., д10/68 пересечение с Ленинским просп.";"КП 098-01";"";"0.12";"Юго-Западный АО";"37.545498";"55.688457";"92387117";
765;"Часы";"Лубочный пер., напротив д4 Садовническая наб.";"КП 098-01";"";"0.12";"Центральный АО";"37.625474";"55.746325";"92387118";
766;"Часы";"Лубянская пл., Памятник узникам репрессий";"КП 098-01";"";"0.12";"Центральный АО";"37.627404";"55.759224";"92387119";
767;"Часы";"площадь Сокольническая Застава, Главный вход в парк ""Сокольники""";"КП 098-01";"";"0.08";"Восточный АО";"37.678216";"55.792221";"92387120";
768;"Часы";"Люблинская ул., д4";"КП 098-01";"";"0.125";"Юго-Восточный АО";"37.731297";"55.704861";"92387121";
769;"Часы";"Люблинская ул., д64 рынок";"КП-098";"";"0.125";"Юго-Восточный АО";"37.739297";"55.67356";"92387122";
770;"Часы";"Устьинский М.мост, пересечение с Подгорской наб.";"КП-098";"";"0.125";"Центральный АО";"37.642298";"55.748452";"92387123";
771;"Часы";"Каменный М.мост, напротив к/т""Ударник""";"КП-098";"";"0.125";"Центральный АО";"37.615488";"55.743042";"92387124";
772;"Часы";"Манежная пл., ; Александровский сад";"КП 098-01";"";"0.12";"Центральный АО";"37.616155";"55.755264";"92387125";
773;"Часы";"Марксистская ул., д4 м.""Марксистская""";"КП-098";"";"0.125";"Центральный АО";"37.656473";"55.741";"92387126";
774;"Часы";"Новогиреевская ул., д49/1 к/т ""Березка""";"АЧС-800";"";"0.08";"Восточный АО";"37.801861";"55.74956";"92387127";
775;"Часы";"Матвеевская ул., д4 к1";"КП-098";"";"0.125";"Западный АО";"37.478224";"55.704252";"92387128";
776;"Часы";"Андроньевская пл., напротив д5/9 пересечение с Николоямской ул.";"КП 098-03";"";"0.125";"Центральный АО";"37.668822";"55.746801";"92387129";
777;"Часы";"Смоленская ул., д6";"КП 098-03";"";"0.125";"Центральный АО";"37.581375";"55.746245";"92387130";
778;"Часы";"Крупской ул., д9а";"КП 098-03";"";"0.125";"Юго-Западный АО";"37.528059";"55.682978";"92387131";
779;"Часы";"Воронцовская ул., д27/35";"КП 098-03";"";"0.125";"Центральный АО";"37.661207";"55.735194";"92387132";
780;"Часы";"Рязанский просп., д30 к1 пересечение с Окской ул.";"КП 098-03";"";"0.125";"Юго-Восточный АО";"37.784914";"55.718225";"92387133";
781;"Часы";"Кутузовский просп., д19 пересечение с ул.Раевского";"КП 098-03";"";"0.125";"Западный АО";"37.551593";"55.745869";"92387134";
782;"Часы";"Крутицкий 3-й пер., д18 пересечение с Воронцовской ул.";"КП 098-03";"";"0.125";"Центральный АО";"37.665539";"55.732143";"92387135";
783;"Часы";"Радио ул., д13 пересечение с Доброслободской ул.";"КП 098-03";"";"0.125";"Центральный АО";"37.674134";"55.763827";"92387136";
784;"Часы";"Энтузиастов шоссе, д24 пересечение с Авиамоторной ул.";"КП 098-03";"";"0.125";"Юго-Восточный АО";"37.718037";"55.751129";"92387137";
785;"Часы";"Грина ул., д11 пересечение с местным пр.";"КП 098-04";"";"0.125";"Юго-Западный АО";"37.5677";"55.567937";"92387138";
786;"Часы";"Бунинская аллея, м.""Бунинская аллея"", 1-я опора на площади";"КП 098-04";"";"0.125";"Юго-Западный АО";"37.514462";"55.537413";"92387139";
787;"Часы";"Ключевая ул., д6 пересечение с местным пр.";"КП 098-04";"";"0.125";"Южный АО";"37.758078";"55.638062";"92387140";
788;"Часы";"Алтуфьевское шоссе, д72 пересечение с ул.Пришвина";"КП 098-04";"";"0.125";"Северо-Восточный АО";"37.586948";"55.889577";"92387141";
789;"Часы";"Ульяновой Марии ул., д10";"КП 098-04";"";"0.125";"Юго-Западный АО";"37.524904";"55.681097";"92387142";
790;"Часы";"Парковая 16-я ул., д2а пересечение с Первомайской ул.";"КП 098-04";"";"0.125";"Восточный АО";"37.823537";"55.791537";"92387143";
791;"Часы";"Куусинена ул., д2 м.""Полежаевская""";"КП 098-04";"";"0.125";"Северный АО";"37.517565";"55.777706";"92387144";
792;"Часы";"Трофимова ул., м.""Кожуховская"" 2 опора пересечение с Южнопортовой ул. 2 оп.";"КП 098-04";"";"0.125";"Юго-Восточный АО";"37.686328";"55.705027";"92387145";
793;"Часы";"Ореховый б-р, д47/33 м. ""Красногвардейская""";"КП 098-01";"";"0.125";"Южный АО";"37.745988";"55.614154";"92387146";
794;"Часы";"Шипиловский пр., д43 к1 пересечение с местным пр-м";"КП 098-01";"";"0.125";"Южный АО";"37.696838";"55.610441";"92387147";
795;"Часы";"Варшавское шоссе, д138 Автопассаж";"КП 098-01";"";"0.125";"Южный АО";"37.610602";"55.613986";"92387148";
796;"Часы";"Варшавское шоссе, д110 пересечение с местным пр-м";"КП 098-01";"";"0.125";"Южный АО";"37.619433";"55.64249";"92387149";
797;"Часы";"Хабаровская ул., д15 к1 ТЦ ""12 месяцев""";"КП 098-01";"";"0.125";"Восточный АО";"37.824675";"55.822649";"92387150";
798;"Часы";"Заозерная ул., д15 ГИБДД";"КП 098-01";"";"0.125";"Восточный АО";"37.84638";"55.718494";"92387151";
799;"Часы";"Косинская Б.ул., д16 к1 пересечение с местным пр-дом";"КП 098-01";"";"0.125";"Восточный АО";"37.853969";"55.711739";"92387152";
800;"Часы";"Старостина Николая ул., напротив д17/3 пересечение с Салтыковской ул.";"КП 098-01";"";"0.125";"Восточный АО";"37.860283";"55.730755";"92387153";
801;"Часы";"Старостина Николая ул., д5 пересечение с Суздальской ул.";"КП 098-01";"";"0.125";"Восточный АО";"37.850164";"55.731219";"92387154";
802;"Часы";"Петрозаводская ул., д24 пересечение с местным пр-м";"КП 098-01";"";"0.125";"Северный АО";"37.493168";"55.866788";"92387155";
803;"Часы";"Полубоярова Маршала ул., д22 пересечение с местным проездом";"КП 098-01";"";"0.125";"Юго-Восточный АО";"37.861793";"55.68272";"92387156";
804;"Часы";"Бунинская аллея, д2 пересечение с ул.Адмирала Лазарева";"КП 098-03";"";"0.125";"Юго-Западный АО";"37.513209";"55.541704";"92387157";
805;"Часы";"Совхозная ул., д41 м ""Люблино""";"КП 098-03";"";"0.125";"Юго-Восточный АО";"37.761108";"55.674221";"92387158";
806;"Часы";"Белореченская ул., д37 к1 пересечение с местным пр.";"КП 098-03";"";"0.125";"Юго-Восточный АО";"37.770831";"55.66439";"92387159";
807;"Часы";"Краснохолмская Нижн.ул., д52 к5 пересечение с Космодамианской наб.";"КП 098-03";"";"0.125";"Центральный АО";"37.642639";"55.733685";"92387160";
808;"Часы";"Бирюзова Маршала ул., д18";"КП 098-03";"";"0.125";"Северо-Западный АО";"37.490608";"55.795111";"92387161";
809;"Часы";"Осенний б-р, д11 м.""Крылатское""";"КП 098-01";"";"0.125";"Западный АО";"37.407331";"55.7579";"92387162";
810;"Часы";"Донского Дмитрия б-р, д13 пересечение с ул.Грина";"КП 098-01";"";"0.125";"Юго-Западный АО";"37.574164";"55.566333";"92387163";
811;"Часы";"Южнобутовская ул., д41 пересечение с Чечерским пр-дом";"КП 098-01";"";"0.125";"Юго-Западный АО";"37.534137";"55.537773";"92387164";
812;"Часы";"Южнобутовская ул., д91 пересечение с местным пр-дом";"КП 098-01";"";"0.125";"Юго-Западный АО";"37.522033";"55.534882";"92387165";
813;"Часы";"Ушакова Адмирала бульв., д5";"КП 098-01";"";"0.125";"Юго-Западный АО";"37.553075";"55.54743";"92387166";
814;"Часы";"Менжинского ул., д38 м ""Бабушкинская""";"КП 098-01";"";"0.12";"Северо-Восточный АО";"37.663201";"55.870006";"92387167";
815;"Часы";"Мира просп., д102 Крестовский мост";"КП 098-01";"";"0.125";"Северо-Восточный АО";"37.636311";"55.801609";"92387168";
816;"Часы";"Мира просп., д108";"КП 098-01";"";"0.12";"Северо-Восточный АО";"37.636813";"55.804362";"92387169";
817;"Часы";"Мира просп., д116 напротив м-н ""Детский мир""";"КП 098-01";"";"0.125";"Северо-Восточный АО";"37.637851";"55.809949";"92387170";
818;"Часы";"Мира просп., д124 к8";"КП 098-04/1";"";"0.14";"Северо-Восточный АО";"37.638301";"55.812845";"92387171";
819;"Часы";"Мира просп., д21 Дом моды Зайцева";"КП 098-01";"";"0.12";"Центральный АО";"37.632435";"55.778674";"92387172";
820;"Часы";"Мира просп., д38 м. ""Пр-т Мира""";"КП 098-01";"";"0.12";"Центральный АО";"37.633232";"55.779597";"92387173";
821;"Часы";"Мира просп., д69";"КП-098";"";"0.125";"Центральный АО";"37.634654";"55.786572";"92387174";
822;"Часы";"Мира просп., д112-114 м. ""Алексеевская""";"КП 098-01";"";"0.12";"Северо-Восточный АО";"37.63745";"55.807763";"92387175";
823;"Часы";"Мичуринский просп., д22 к1";"КП 098-01";"";"0.125";"Западный АО";"37.504266";"55.701194";"92387176";
824;"Часы";"Мичуринский просп., д38";"КП 098-04/1";"";"0.14";"Западный АО";"37.497532";"55.69745";"92387177";
825;"Часы";"Мичуринский просп., д54 к1";"КП-098";"";"0.125";"Западный АО";"37.49101";"55.693618";"92387178";
826;"Часы";"Мичуринский просп., д8/29, пл. Индиры Ганди";"КП-098";"";"0.125";"Западный АО";"37.512158";"55.706584";"92387179";
827;"Часы";"Можайское шоссе, д54 к/т ""Минск""";"КП 098-01";"";"0.12";"Западный АО";"37.401615";"55.716164";"92387180";
828;"Часы";"Москворецкая ул., пересечение с ул. Варварка (гос. ""Россия"")";"КП 098-01";"";"0.12";"Центральный АО";"37.62536";"55.751631";"92387181";
829;"Часы";"Мосфильмовская ул., д72 А пересечение с ул.Минская";"КП 098-01";"";"0.12";"Западный АО";"37.50731";"55.711148";"92387182";
830;"Часы";"Мосфильмовская ул., напротив д17 Университетский просп.";"КП 098-01";"";"0.125";"Западный АО";"37.516182";"55.716087";"92387183";
831;"Часы";"Моховая ул., д15/1 пересечение с ул.Тверская д1(Манежная пл.)";"КП 098-01";"";"0.12";"Центральный АО";"37.614604";"55.756868";"92387184";
832;"Часы";"Моховая ул., д5 Российская гос. библиотека";"КП 098-01";"";"0.12";"Центральный АО";"37.609881";"55.751269";"92387185";
833;"Часы";"Мясницкая ул., напротив д26 Б м.""Тургеневская""";"КП 098-01";"";"0.12";"Центральный АО";"37.636926";"55.76501";"92387186";
834;"Часы";"Народного Ополчения ул., д28 пересечение с ул.Тухачевского";"КП 098-01";"";"0.125";"Северо-Западный АО";"37.481199";"55.782558";"92387187";
835;"Часы";"Народного Ополчения ул., д36 м.""Октябрьское поле""";"КП-098";"";"0.125";"Северо-Западный АО";"37.485345";"55.788335";"92387188";
836;"Часы";"Неглинная ул., напротив д2/6 пересечение с ул.Пушечная (ЦУМ)";"КП 098-01";"";"0.12";"Центральный АО";"37.620779";"55.760731";"92387189";
837;"Часы";"Никитские Ворота площадь, ; пересечение с Тверским бульв.";"КП-098";"";"0.125";"Центральный АО";"37.598594";"55.757686";"92387190";
838;"Часы";"Басманная Старая ул., д38/2 пересечение с ул.Ст.Басманная, пл. Разгуляй";"КП 098-01";"";"0.12";"Центральный АО";"37.669275";"55.769554";"92387191";
839;"Часы";"Новая пл., д3/4 Политехнический музей (в центре)";"КП-098";"";"0.125";"Центральный АО";"37.628945";"55.757688";"92387192";
