ROWNUM;Name;Location;Type;TypePhoto;Power;AdmArea;X_WGS;Y_WGS;GLOBALID;
561;"Часы";"Проточный пер., д11 пересечение со Смоленским пер.";"КП 098-01";"";"0.125";"Центральный АО";"37.579189";"55.750303";"92386911";
562;"Часы";"Дмитровское шоссе, напротив д13/15 м.""Тимирязевская"" из центра";"КП 098-01";"";"0.125";"Северный АО";"37.575226";"55.818483";"92386912";
563;"Часы";"Дмитровское шоссе, д13/15 м.""Тимирязевская"" в центр";"КП 098-01";"";"0.125";"Северный АО";"37.574776";"55.818323";"92386913";
564;"Часы";"Введенского ул., напротив д4 пересечение с местным пр.";"КП 098-01";"";"0.125";"Юго-Западный АО";"37.549799";"55.64931";"92386914";
565;"Часы";"Авиамоторная ул., д39 Лефортовский рынок";"КП 098-01";"";"0.125";"Юго-Восточный АО";"37.716075";"55.753942";"92386915";
566;"Часы";"Энтузиастов шоссе, д20 пересечение с Авиамоторной ул.";"КП 098-01";"";"0.125";"Юго-Восточный АО";"37.716117";"55.751191";"92386916";
567;"Часы";"Краснокурсантский 1-й пр., напротив д7 пересечение с Солдатской ул.";"КП 098-01";"";"0.125";"Юго-Восточный АО";"37.701333";"55.765174";"92386917";
568;"Часы";"Петровка ул., д5/7 пересечение с ул.Кузнецкий мост";"КП 098-01";"";"0.125";"Центральный АО";"37.618033";"55.76177";"92386918";
569;"Часы";"Очаковская Б.ул., д30 пересечение с ул.Пржевальского";"КП 098-01";"";"0.125";"Западный АО";"37.453045";"55.680528";"92386919";
570;"Часы";"Профсоюзная ул., д43 к1 м.""Новые Черемушки""";"КП 098-01";"";"0.125";"Юго-Западный АО";"37.553573";"55.669006";"92386920";
571;"Часы";"Крымский вал ул., напротив д8 ЦПКиО им.Горького";"КП 098-01";"";"0.125";"Центральный АО";"37.607464";"55.731389";"92386921";
572;"Часы";"Снежная ул., д19 пересечение с пр-м Нансена";"КП 098-01";"";"0.125";"Северо-Восточный АО";"37.649571";"55.853781";"92386922";
573;"Часы";"Симферопольский б-р, д29";"КП 098-01";"";"0.125";"Южный АО";"37.605776";"55.645983";"92386923";
574;"Часы";"Профсоюзная ул., д61 пересечение с местным проездом";"КП 098-01";"";"0.125";"Юго-Западный АО";"37.540752";"55.65707";"92386924";
575;"Часы";"Чонгарский б-р, д4 к1, пересечение с Варшавским ш.";"КП 098-01";"";"0.125";"Южный АО";"37.618227";"55.653506";"92386925";
576;"Часы";"Свободный просп., д60/35 стр4 пересечение с Зеленым просп.";"КП 098-01";"";"0.125";"Восточный АО";"37.818976";"55.751322";"92386926";
577;"Часы";"Планерная ул., д5 пересечение с местным пр-м";"КП 098-01";"";"0.125";"Северо-Западный АО";"37.434667";"55.861794";"92386927";
578;"Часы";"Сходненская ул., д54 пересечение с Химкинским б-ром";"КП 098-01";"";"0.125";"Северо-Западный АО";"37.440403";"55.850172";"92386928";
579;"Часы";"Барклая ул., д10-12 м ""Багратионовская""";"КП 098-01";"";"0.125";"Западный АО";"37.498421";"55.743155";"92386929";
580;"Часы";"Земляной вал ул., д3/1 стр7 пересечение с ул.Казакова";"КП 098-01";"";"0.125";"Центральный АО";"37.657277";"55.762923";"92386930";
581;"Часы";"Садовая-Каретная ул., д18/10 пересечение с ул.Каретный ряд";"КП 098-01";"";"0.125";"Центральный АО";"37.609557";"55.77299";"92386931";
582;"Часы";"Филевская Б. ул., д21/19 к1 пересесение с ул.Барклая";"КП 098-01";"";"0.125";"Западный АО";"37.494533";"55.747149";"92386932";
583;"Часы";"Люблинская ул., д165 3-опора пересечение с Новомарьинской ул.";"КП 098-01";"";"0.125";"Юго-Восточный АО";"37.745257";"55.650229";"92386933";
584;"Часы";"Буденного просп., д28 к2 пересечение с 5-й ул.Соколиной горы";"АЧС 2-900";"";"0.125";"Восточный АО";"37.73422";"55.763073";"92386934";
585;"Часы";"Новопесчаная ул., д14 к/т ""Дружба""";"КП 098-01";"";"0.12";"Северный АО";"37.512391";"55.796406";"92386935";
586;"Часы";"Вавилова ул., д55, пересечение с ул.Дм.Ульянова";"КП 098-01";"";"0.125";"Юго-Западный АО";"37.561797";"55.691677";"92386936";
587;"Часы";"Вавилова ул., д57 к3 (на здании)";"ВНУ-2";"";"0.06";"Юго-Западный АО";"37.560068";"55.689776";"92386937";
588;"Часы";"Вавилова ул., д65а, пересечение с Кржижановского ул.";"АЧС-800";"";"0.08";"Юго-Западный АО";"37.554269";"55.685369";"92386938";
589;"Часы";"Варшавское шоссе, д14 стадион 'Труд""";"КП 098-04/1";"";"0.14";"Южный АО";"37.620532";"55.695915";"92386939";
590;"Часы";"Варшавское шоссе, д5 ф-ка им. Фрунзе";"КП 098-01";"";"0.12";"Южный АО";"37.62154";"55.701301";"92386940";
591;"Часы";"Варшавское шоссе, д89";"КП 098-01";"";"0.08";"Южный АО";"37.619835";"55.651547";"92386941";
592;"Часы";"Варшавское шоссе, д59 А развилка с Каширским ш.";"АЧС-800";"";"0.08";"Южный АО";"37.627263";"55.674833";"92386942";
593;"Часы";"Вернадского просп., пересечение с Университетским просп.";"КП 098-01";"";"0.12";"Западный АО";"37.535708";"55.693097";"92386943";
594;"Часы";"Лобачевского ул., пересечение с просп.Вернадского";"АЧС 2-900";"";"0.125";"Западный АО";"37.495013";"55.670777";"92386945";
595;"Часы";"Вернадского просп., д7 Цирк";"КП 098-01";"";"0.12";"Юго-Западный АО";"37.539378";"55.695386";"92386946";
596;"Часы";"Вернадского просп., д39 м. ""Пр-т Вернадского""";"КП-098";"";"0.125";"Западный АО";"37.505789";"55.676256";"92386947";
597;"Часы";"Вернадского просп., д84-86 м.""Юго-западная"" чет.ст.";"КП 098-01";"";"0.12";"Западный АО";"37.481951";"55.662304";"92386948";
598;"Часы";"Винокурова ул., д15,пересечение с ул.Б. Черемушкинская";"АЧС-800";"";"0.08";"Юго-Западный АО";"37.59318";"55.686161";"92386949";
599;"Часы";"Дружинниковская ул., напротив д15";"КП 098-01";"";"0.12";"Центральный АО";"37.576058";"55.759955";"92386950";
600;"Часы";"Волгоградский просп., д19 ул. Талалихина";"КП-098";"";"0.125";"Юго-Восточный АО";"37.681166";"55.727822";"92386951";
601;"Часы";"Волгоградский просп., д119 А дублер Волгоградского просп.";"КП-098";"";"0.125";"Юго-Восточный АО";"37.765918";"55.706125";"92386952";
602;"Часы";"Волоколамское шоссе, д26";"КП 098-03";"";"0.12";"Северный АО";"37.483037";"55.811483";"92386953";
603;"Часы";"Красный Казанец ул., вл.18 Станция метро ""Выхино""";"КП-098";"";"0.08";"Восточный АО";"37.819855";"55.716772";"92386954";
604;"Часы";"Гарибальди ул., д19 к/т ""Черемушки""";"АЧС-800";"";"0.08";"Юго-Западный АО";"37.5493";"55.672451";"92386955";
605;"Часы";"Ульянова Дмитрия ул., д35-37 пересечение с ул.Б. Черемушкинская";"КП 098-01";"";"0.12";"Юго-Западный АО";"37.588053";"55.683075";"92386956";
606;"Часы";"Ульянова Дмитрия ул., д20";"КП 098-01";"";"0.125";"Юго-Западный АО";"37.571246";"55.688178";"92386957";
607;"Часы";"Дмитровское шоссе, напротив д5";"КП 098-04/1";"";"0.1";"Северный АО";"37.578104";"55.813225";"92386958";
608;"Часы";"Дмитровское шоссе, д9 Институт зерна";"КП 098-04";"";"0.125";"Северный АО";"37.576258";"55.815607";"92386959";
609;"Часы";"Дорогомиловская Б.ул., д8";"КП 098-01";"";"0.12";"Западный АО";"37.56612";"55.745788";"92386960";
610;"Часы";"Душинская ул., д5 2-й ЭТР(2 уч.)";"КП 098-01";"";"0.12";"Юго-Восточный АО";"37.705499";"55.745789";"92386961";
611;"Часы";"Елоховский пр., д1 Елоховский собор";"АЧС-800";"";"0.08";"Центральный АО";"37.673867";"55.772702";"92386962";
612;"Часы";"Енисейская ул., д23";"КП 098-01";"";"0.125";"Северо-Восточный АО";"37.663721";"55.86847";"92386963";
613;"Часы";"Житная ул., д12-14 МВД архив";"КП 098-01";"";"0.12";"Центральный АО";"37.615976";"55.73023";"92386964";
614;"Часы";"Жукова Маршала просп., д26 к2";"КП 098-01";"";"0.125";"Северо-Западный АО";"37.48124";"55.775479";"92386965";
615;"Часы";"Зацепский вал ул., напротив д4, Сад. кольцо (м ""Павелецкая"")";"КП 098-01";"";"0.12";"Центральный АО";"37.634301";"55.730975";"92386966";
616;"Часы";"14-й микрорайон, магазин ""Александр-СМ""";"КП 098-01";"";"0.12";"Зеленоградский АО";"37.151507";"55.98418";"92386967";
617;"Часы";"Панфиловский просп., к.1104 пересечение с местным пр.";"КП 098-04";"";"0.125";"Зеленоградский АО";"37.188466";"55.994109";"92386968";
618;"Часы";"Юности пл., остановка 400-го маршрута";"КП 098-01";"";"0.12";"Зеленоградский АО";"37.211344";"56.001294";"92386969";
619;"Часы";"8-й микрорайон, станция ""Крюково"" со стороны 8-го мкр-на";"КП 098-01";"";"0.12";"Зеленоградский АО";"37.175221";"55.980638";"92386970";
620;"Часы";"18-й микрорайон, станция ""Крюково"" со стороны 18-го мкр-н";"КП 098-01";"";"0.12";"Зеленоградский АО";"37.172988";"55.979545";"92386971";
621;"Часы";"Центральный просп., пересечение с Савеловским пр. у здания префектуры";"КП 098-01";"";"0.12";"Зеленоградский АО";"37.214948";"55.992088";"92386972";
622;"Часы";"Зеленый просп., д81 к/т ""Киргизия""";"КП 098-01";"";"0.08";"Восточный АО";"37.821088";"55.751669";"92386973";
623;"Часы";"Люблинская ул., д165 к2 с обр.ст.""Макдоналдса""";"КП 098-01";"";"0.125";"Юго-Восточный АО";"37.744233";"55.649756";"92386974";
624;"Часы";"Бутырская ул., д89 к2 пересечение с 1-й Хуторской ул.";"КП 098-01";"";"0.125";"Северный АО";"37.5818";"55.80566";"92386975";
625;"Часы";"Сущевский Вал ул., напротив д59 пересечение с Шереметьевской ул.";"КП 098-01";"";"0.125";"Северо-Восточный АО";"37.615617";"55.793261";"92386976";
626;"Часы";"Сущевский Вал ул., д55 пересечение с ул.Октябрьской";"КП 098-01";"";"0.125";"Северо-Восточный АО";"37.614589";"55.793479";"92386977";
627;"Часы";"Пресненский вал ул., д5 пересесение с Расторгуевским пер.";"КП 098-01";"";"0.125";"Центральный АО";"37.564405";"55.766467";"92386978";
628;"Часы";"Кибальчича ул., напротив д6 пересечение с Ярославской ул.(5 оп)";"КП 098-01";"";"0.125";"Северо-Восточный АО";"37.649592";"55.816066";"92386979";
629;"Часы";"Михалковская ул., д15 пересечение с пр-м Черепановых";"КП 098-01";"";"0.125";"Северный АО";"37.52539";"55.839965";"92386980";
630;"Часы";"Мичуринский просп., д3 к1 Олимпийская деревня у ТЦ ""Фестивальный""";"КП 098-01";"";"0.125";"Западный АО";"37.464907";"55.677669";"92386981";
631;"Часы";"Теплый Стан ул., напротив д5 пересечение с местным пр.";"КП 098-01";"";"0.125";"Юго-Западный АО";"37.499202";"55.621798";"92386982";
632;"Часы";"Мастеркова ул., д2";"КП 098-01";"";"0.125";"Южный АО";"37.657425";"55.709077";"92386983";
633;"Часы";"Милашенкова ул., д4 пересечение с ул.Фонвизина";"КП 098-01";"";"0.125";"Северо-Восточный АО";"37.589102";"55.822233";"92386984";
634;"Часы";"Кутузовский просп., д48, съезд к Торговому Дому";"КП 098-01";"";"0.125";"Западный АО";"37.487892";"55.731328";"92386985";
635;"Часы";"Южнопортовая ул., д18 м.""Кожуховская""";"КП 098-01";"";"0.125";"Юго-Восточный АО";"37.68548";"55.705824";"92386986";
636;"Часы";"Победы пл., д1а пересечение с ул.1812 года";"КП 098-01";"";"0.125";"Западный АО";"37.522586";"55.736865";"92386987";
637;"Часы";"Тульская Б. ул., д13";"КП 098-01";"";"0.125";"Южный АО";"37.621589";"55.708283";"92386988";
638;"Часы";"Авиамоторная ул., д40 пересечение с 4-й Кабельной ул.";"КП 098-01";"";"0.125";"Юго-Восточный АО";"37.720829";"55.741765";"92386989";
639;"Часы";"Ленинский просп., д154";"КП 098-01";"";"0.125";"Западный АО";"37.489289";"55.65288";"92386990";
640;"Часы";"Ленинградское шоссе, д92/1 пересечение с Фестивальной ул.";"КП 098-01";"";"0.125";"Северный АО";"37.47195";"55.85324";"92386991";
641;"Часы";"Ленинградское шоссе, между д13-15, местный выезд";"КП 098-01";"";"0.125";"Северный АО";"37.496543";"55.820242";"92386992";
642;"Часы";"Пятницкое шоссе, д25 пересечение с ул.Дубравной";"КП 098-01";"";"0.125";"Северо-Западный АО";"37.367218";"55.849529";"92386993";
643;"Часы";"Дмитровское шоссе, д27/1 пересечение с Красностуденческим пр.";"КП 098-01";"";"0.125";"Северный АО";"37.572573";"55.826422";"92386994";
644;"Часы";"1905 года ул., д7";"КП 098-01";"";"0.125";"Центральный АО";"37.559341";"55.761703";"92386995";
645;"Часы";"1905 года ул., д17 пересечение с Б.Декабрьской ул.";"КП 098-01";"";"0.125";"Центральный АО";"37.559761";"55.766159";"92386996";
646;"Часы";"Красногвардейский 1-й пр., напротив д12";"КП 098-01";"";"0.125";"Центральный АО";"37.543749";"55.752911";"92386997";
647;"Часы";"Грузинский вал ул., д18/15 пересечение с Грузинским пер.";"КП 098-01";"";"0.125";"Центральный АО";"37.578454";"55.773522";"92386998";
648;"Часы";"Пресненский вал ул., д6 пересечение со Столярным пер.";"КП 098-01";"";"0.125";"Центральный АО";"37.564115";"55.764394";"92386999";
649;"Часы";"Пресненский вал ул., д1/2 м.""Улица 1905 года""";"КП 098-01";"";"0.125";"Центральный АО";"37.561982";"55.763711";"92387000";
650;"Часы";"Каширское шоссе, д106 А пересечение с Ореховым б-ром 2 оп.";"КП 098-01";"";"0.125";"Южный АО";"37.716565";"55.61143";"92387001";
651;"Часы";"Домодедовская ул., д25/1 пересечение с местным пр. между д23-25";"КП 098-01";"";"0.125";"Южный АО";"37.713519";"55.604651";"92387002";
652;"Часы";"Ленинградский просп., д20 пересечение с ул.Правды";"КП 098-01";"";"0.125";"Северный АО";"37.574966";"55.781802";"92387003";
653;"Часы";"Бескудниковский б-р, д6 пересечение с местным пр-дом";"КП 098-01";"";"0.125";"Северный АО";"37.562381";"55.858241";"92387004";
654;"Часы";"Павелецкая пл., напротив д2 стр2 пересечение с ул.Валовая";"КП 098-01";"";"0.125";"Центральный АО";"37.636502";"55.730677";"92387005";
655;"Часы";"Ленинградский просп., д32 пересечение с ул.Марии Расковой";"КП 098-01";"";"0.125";"Северный АО";"37.569856";"55.784172";"92387006";
656;"Часы";"Боровское шоссе, д20 1-я опора пересечение с Приречной ул.(1 опора)";"КП 098-01";"";"0.125";"Западный АО";"37.371004";"55.648966";"92387007";
657;"Часы";"Боровское шоссе, д19 5-я опора по Приречной ул.";"КП 098-01";"";"0.125";"Западный АО";"37.372178";"55.646531";"92387008";
658;"Часы";"Кастанаевская ул., д54 к3 м.""Пионерская""";"КП 098-01";"";"0.125";"Западный АО";"37.467361";"55.735834";"92387009";
659;"Часы";"Беловежская ул., д1 пересечение с Вяземской ул.";"КП 098-01";"";"0.125";"Западный АО";"37.402188";"55.715301";"92387010";
660;"Часы";"Дорогомиловская Б.ул., д16 пересечение с местным пр-м";"КП 098-01";"";"0.125";"Западный АО";"37.557012";"55.746543";"92387011";
661;"Часы";"Зеленый просп., д105,пересечение с ул.Молостовых";"АЧС-800";"";"0.08";"Восточный АО";"37.830364";"55.749577";"92387012";
662;"Часы";"Зеленый просп., д30/1";"КП 098-01";"";"0.125";"Восточный АО";"37.798639";"55.75344";"92387013";
663;"Часы";"Профсоюзная ул., д13/12";"КП 098-01";"";"0.125";"Юго-Западный АО";"37.565926";"55.680422";"92387014";
664;"Часы";"Зеленый просп., д81 м.""Новогиреево""";"КП 098-01";"";"0.12";"Восточный АО";"37.819329";"55.751461";"92387015";
665;"Часы";"Голубинская ул., д9";"КП 098-04/1";"";"0.14";"Юго-Западный АО";"37.512223";"55.602928";"92387016";
666;"Часы";"Земляной вал ул., д46/48";"КП 098-01";"";"0.12";"Центральный АО";"37.65584";"55.752752";"92387017";
667;"Часы";"Земляной вал ул., д35, 6-я опора после пересечения с В.Сыромятнической ул., в центр";"КП 098-01";"";"0.08";"Центральный АО";"37.657884";"55.756508";"92387018";
668;"Часы";"Зубовская площадь, д3 пересечение с ул. Б.Пироговская";"КП 098-01";"";"0.12";"Центральный АО";"37.584041";"55.737476";"92387019";
669;"Часы";"Долгоруковская ул., д39/6";"КП 098-01";"";"0.12";"Центральный АО";"37.600555";"55.780244";"92387020";
670;"Часы";"Пролетарский просп., пересечение с Кавказским б-ром";"АЧС 2-900";"";"0.125";"Южный АО";"37.661922";"55.628964";"92387021";
671;"Часы";"Каланчевская ул., д1 м ""Красные ворота""";"КП 098-01";"";"0.12";"Центральный АО";"37.649952";"55.768987";"92387022";
672;"Часы";"Рижский пр., д11";"КП 098-01";"";"0.12";"Северо-Восточный АО";"37.656026";"55.776057";"92387023";
673;"Часы";"Карбышева Генерала бульв., пересечение с ул.Тухачевского, д30";"КП 098-01";"";"0.12";"Северо-Западный АО";"37.472572";"55.784262";"92387024";
674;"Часы";"Каретный ряд ул., д1 Театр ""Эрмитаж""";"КП 098-01";"";"0.12";"Центральный АО";"37.610674";"55.771057";"92387025";
675;"Часы";"Катукова Маршала ул., д11 к/т ""Таджикистан""";"КП 098-03";"";"0.12";"Северо-Западный АО";"37.403794";"55.810516";"92387026";
676;"Часы";"Катукова Маршала ул., д18 Универсам пересечение со Строгинским ш.";"КП 098-01";"";"0.125";"Северо-Западный АО";"37.40816";"55.807505";"92387027";
677;"Часы";"Каширское шоссе, д28 к1 пересечение с пр-том Андропова";"АЧС-800";"";"0.08";"Южный АО";"37.649856";"55.654407";"92387028";
678;"Часы";"Каширское шоссе, д42 к/т ""Мечта""";"АЧС 2-900";"";"0.125";"Южный АО";"37.662362";"55.649151";"92387030";
679;"Часы";"Андропова Ю.В. просп., д21 м.""Коломенская"" северный выход";"АЧС-800";"";"0.08";"Южный АО";"37.664698";"55.679258";"92387031";
680;"Часы";"Комсомольский просп., д41, пересечение с ул. 3-я Фрунзенская";"КП 098-04/1";"";"0.14";"Центральный АО";"37.575463";"55.721792";"92387032";
681;"Часы";"Комсомольский просп., д12 пересечение с ул.Льва Толстого";"АЧС-800";"";"0.08";"Центральный АО";"37.591431";"55.731701";"92387033";
682;"Часы";"Комсомольский просп., д2 м.""Парк культуры""";"ВНУ-2";"";"0.08";"Центральный АО";"37.593042";"55.733962";"92387034";
683;"Часы";"Комсомольский просп., д28 МДМ пересечение с Хользунова ул.";"КП 098-01";"";"0.125";"Центральный АО";"37.581405";"55.726897";"92387035";
684;"Часы";"Комсомольский просп., д49, пересечение с ул. Хамовнический вал";"КП 098-01";"";"0.12";"Центральный АО";"37.572414";"55.719536";"92387036";
685;"Часы";"Коптевская ул., д8";"КП 098-01";"";"0.12";"Северный АО";"37.517325";"55.827402";"92387037";
686;"Часы";"Косыгина ул., Дворец пионеров";"КП 098-01";"";"0.12";"Юго-Западный АО";"37.555764";"55.705918";"92387038";
687;"Часы";"Яузская ул., д1/15 пересечение с Яузским б-м";"КП-098";"";"0.125";"Центральный АО";"37.643111";"55.750418";"92387039";
688;"Часы";"Красная пресня ул., д2 Зоопарк";"КП-098";"";"0.125";"Центральный АО";"37.578188";"55.760897";"92387040";
689;"Часы";"Красная пресня ул., д1 м""Краснопресненская""";"КП 098-01";"";"0.12";"Центральный АО";"37.577666";"55.760664";"92387041";
690;"Часы";"Красная пресня ул., д16/2";"КП-098";"";"0.125";"Центральный АО";"37.571355";"55.761725";"92387042";
691;"Часы";"площадь Краснопресненская Застава, Краснопресненской Заставы пл. м.""1905 г.""";"КП 098-01";"";"0.12";"Центральный АО";"37.562609";"55.763264";"92387043";
692;"Часы";"Краснопролетарская ул., д9, напротив д14/2";"КП-098";"";"0.08";"Центральный АО";"37.607004";"55.776616";"92387044";
693;"Часы";"Краснопрудная ул., д26 к1 напротив м ""Красносельская""";"КП 098-01";"";"0.12";"Центральный АО";"37.66667";"55.779925";"92387045";
694;"Часы";"Кржижановского ул., д19 пересечение с ул.Новочеремушкинская";"АЧС-800";"";"0.08";"Юго-Западный АО";"37.575038";"55.678543";"92387046";
695;"Часы";"Зубовский б-р, д13-15";"КП 098-01";"";"0.08";"Центральный АО";"37.592579";"55.735784";"92387047";
696;"Часы";"Крымский вал ул., д9 ЦПКО им Горького";"КП 098-01";"";"0.12";"Центральный АО";"37.605962";"55.731581";"92387048";
697;"Часы";"Кулакова ул., д14";"КП 098-01";"";"0.125";"Северо-Западный АО";"37.396072";"55.808916";"92387049";
698;"Часы";"Кутузовский просп., д22 напротив ул. Дунаевского";"КП 098-01";"";"0.12";"Западный АО";"37.550101";"55.745953";"92387051";
699;"Часы";"Щербаковская ул., д3 пересечение с Вельяминовской ул.";"КП 098-01";"";"0.125";"Восточный АО";"37.722899";"55.782275";"92387052";
